{
  "schema_version": "coverage-manifest-v1",
  "layer": "canonical",
  "dataset_kind": "trades",
  "venue": "bybit",
  "instrument": "BTCUSDT",
  "record_schema_id": "trade-v1",
  "coverage_id": "bybit-btcusdt-backfill-2024-01-15-repair",
  "supersedes": "bybit-btcusdt-live-2024-01-15-seg-1",
  "created_at": "2024-01-16T04:30:00Z",
  "acquisition": {
    "basis": "backfill",
    "intent_start": "2024-01-15T00:00:00Z",
    "intent_end": "2024-01-16T00:00:00Z",
    "source_semantics": "bybit-public-trades-archive-v1",
    "mapping": "bybit-archive-interval-v1"
  },
  "assertions": [
    {
      "assertion_id": "repaired-full-day",
      "start": "2024-01-15T00:00:00Z",
      "end": "2024-01-16T00:00:00Z",
      "status": "complete",
      "partitions": [
        {
          "partition_key": "dt=2024-01-15",
          "revision": 2
        }
      ],
      "evidence": [
        {
          "kind": "connection_continuity",
          "detail": "sessione live originaria, salvo [12:00:03Z, 12:00:07Z)"
        },
        {
          "kind": "archive_completeness",
          "detail": "archivio autorevole della giornata scaricato e verificato integro"
        },
        {
          "kind": "reconciliation",
          "detail": "backfill di [12:00:03Z, 12:00:07Z) completato: 0 trade pubblicati in quell'intervallo"
        }
      ]
    }
  ],
  "producer": "bybit-backfill",
  "code_ref": "4f1a9c3"
}
