{
  "schema_version": "coverage-manifest-v1",
  "layer": "canonical",
  "dataset_kind": "trades",
  "venue": "bybit",
  "instrument": "BTCUSDT",
  "record_schema_id": "trade-v1",
  "coverage_id": "bybit-btcusdt-microsecond-boundary",
  "supersedes": null,
  "created_at": "2024-03-01T09:12:00Z",
  "acquisition": {
    "basis": "source_archive",
    "intent_start": "2024-01-15T12:00:00.100000Z",
    "intent_end": "2024-01-15T12:00:00.900000Z",
    "source_semantics": "bybit-public-trades-archive-v1",
    "mapping": "bybit-archive-hour-v1"
  },
  "assertions": [
    {
      "assertion_id": "microsecond-window",
      "start": "2024-01-15T12:00:00.100000Z",
      "end": "2024-01-15T12:00:00.900000Z",
      "status": "complete",
      "partitions": [
        {
          "partition_key": "dt=2024-01-15/hour=12",
          "revision": 1
        }
      ],
      "evidence": [
        {
          "kind": "archive_completeness",
          "detail": "finestra di prova al limite di precisione ammesso"
        }
      ]
    }
  ],
  "producer": "bybit-archive-importer",
  "code_ref": "4f1a9c3"
}
